prefix,input_text,target_text
tag classification,Question about iCloud backupsDoes goodnotes backup your element stickers and sticky notes or just pages and templates by themselves?? Please help it’s urgent:)Everything added to the elements are saved in iCloud Thanks so much:)),Question
tag classification,"Took randomly stops working ?I don’t know if anyone else has experienced this but I’ll be writing and switch to highlight something, but the highlighter doesn’t work. If I switch to any other tool or switch back to writing, I’m able to write just fine. The only thing that fixed it is switching to another notebook and then switching back.

This isn’t limited to one tool, it can happen with the pen, the eraser, the highlighter, etc. I’ve updated the app, my iPad is up to date, my Apple Pencil is charged and works just fine with the app otherwise. 

Any ideas?Happens to me too. But it goes back to normal when I close the the app",Question
tag classification,"Free Hyperlinked A4 Notebooks (5 Tabs) - Link in comments![removed]  Hi guys! I made 2 free digital notebooks for download. Both are A4/portrait/hyperlinked. Here's the download link:

[https://drive.google.com/drive/u/2/folders/13F3Qu\_oMMr6\_NjHWJpAg67rKuHiarlPE](https://drive.google.com/drive/u/2/folders/13F3Qu_oMMr6_NjHWJpAg67rKuHiarlPE)

I'm planning on selling planners and notebooks in the future. But as practice, I created these two for free.

Please let me know what you think about the notebooks! Also, what templates are most useful to you? Are there specific planner spreads that you need but rarely find? I might make more stuff to give away so I'd really love your opinion! Clean and simple, thank you",Templates
tag classification,"Students who use goodnotes, what do you do with all your notes at the end of semester?I just finished my first semester using goodnotes, and I don’t really want or need anything from last semester. I was thinking about backing everything up one final time to my laptop and then deleting it all on the app, to basically start over. Has anyone else done this? Any other suggestions?Im not done with my semester yet but I’ll definitely do the same! I am at the end of my semester now. And I was thinking of keeping them in goodnotes as a separate file, so that I can look up definitons and such. But one problem I see is that goodnotes might take up a lot of storage after some time. I backed all my files to Google drive and deleted them from my ipad! That way, I’m saving storage space on goodnotes but I can always easily re-access my notes on GDrive if needed",Question
tag classification,"Do you have storage issues? How much storage does GoodNotes take up for you?I‘m planning on getting an iPad for uni and going completely paperless. I’m trying to figure out if I should choose Notability or GoodNotes. GoodNotes appeals to me but I heard it takes up a lot of storage and that issues with auto backups can occur.. I‘m planning on getting an iPad with 64gb and I’m worried at some point I will get storage issuesHey, I just got a 32 GB iPad and although I haven't had any storage issues I do regret my decision a tad. I have the iPad 10.2 so they didn't have a 64gb option so regarding my budget I decided to get the 32gb instead of the 128gb. If they had a 64gb option with my iPad I definitely would of chosen that and been more happier.I think 64gb will be perfect for you and is the perfect inbetween. Although I haven't used goodnotes for too long it has taken up barely much space so I think you'll be just fine! I’ve been using Good Notes for almost 2 years and it’s taken no more than 3GB of storage What type of iPad are you planning on getting? 64GB is workable on a tablet, but I always go by the mantra that one can never have too much storage.",Question
tag classification,"How to bring back the camera option?Hi, my Goodnotes 5 updated a few days ago. I noticed it added a new elements option to the toolbar but removed the camera option. I rely heavily on the camera option to take photos of the teacher's chalkboardDoes anyone. Anyone know how I can bring it back? I don't want to take a photo from the camera and then import it into Goodnotes using the picture option as that is super time consuming and in class that's just not feasible. Please help!Check if GoodNotes is allowed to access the camera in the settings. A couple of people here have had the Problem that the toggle was pushed to ""no access"" without them knowing I just checked mine, if you click on the icon to add an image, the camera button shows up in the toolbar The cemera tool is moved within the contectual menu of Elements tool since v5.7 I believe.",Question
tag classification,"First Attempt With GoodNotes! Any thought?Nice color scheme! I recommend using the square paper to make your words even neater :) Is square better than dot grid? I’m always confused by which one to use Personally I always use square, like I try to fit my word into for example a full grid for the subtitle and 2/3 of a grid for body text, etc. It helps align both the size of your letters and also make you write in a straight line!

Also I change the template back to blank so it looks ""cleaner"" haha",Review
tag classification,"How I Make Effective Notes with GoodnotesAre those two different po' boys or one with roast beef and shrimp?  The combo sounds like it could work Done, please upvote my Pinned Post! Oh please! join r/banglaAudiobook you've been recruited",Review
tag classification,"ISO template in light modeThat’s a great way to look at it. Thanks! Arkadaşım, hiçbir kadın vajinası olup östorojen salgıladığı için öldürülmüyor. Öldürülmelerinin sebebi yetiştikleri kültüre veya partnerlerinin veya ailelerinin kültürüne göre onları rezil ediceklerini düşündükleri şeyler yapmaları ya da kız arkadaşlarının/eşlerinin  ayrılmasını kendine yediremeyecek kadar şerefsiz olması. Hedefi doğru belirlemiyorsunuz feministler olarak ben feminizm hakkında bir sürü insanın görüşüne danıştım ve bir sürü kaynağa da baktım. Yani yazacak çok şeyim var. Hedefi doğru belirlememe konusuna geliyorum, şimdi 10 çocuk düşün hepsi şişman ve hepsinde zeka geriliği var. Bu çocukları bir teste soktuk ve hepsi başarısız oldu. Başarısızlıklarının sebebi olarak şişman olmalarını gösterirsem tam da senin yaptığın şey olur. Oysaki başarısızlıklarının sebebi zeka geriliği olması. Şimdi konumuza dönelim 10 erkek düşün, bunların hepsi eşlerini veya bir aile üyesini kültürüne uymadığı için öldürmüş kişiler olsun. Bunların kötü olan özelliği erkek olmaları mı yoksa bok gibi kültürlerde yetişmiş ve bunu benimsemiş olmaları mı? Türkiyede feminist olduğunu iddia edenlerin de yarısı erkek düşmanı. Ben senden daha az eğitimli 100 kişiyle tartışmış olsam bunlardan 50 tanesi feminist gibi geçinen erkek düşmanları. Tarihte onlara eziyeti ben çektirmedim onlara ama benim gibi insanlardan intikam almaya çalışıyorlar gibi oluyor. oh so is there a reason you couldn't have just answered the question without being rude about it? ""YoU kNow ThAt PLENTY oF fAnS.."" if I knew that, would I have asked this? lmao did I offend you by not knowing every detail? 

also, your math is pretty off. Hannah is 3 when they're captured? 10 where we are now? that's 7 years... June's journey is 2 years + 2 years = 4 years , plus 8 months?

so.. 4 years and 8 months don't exactly close the gap. where does it ever say Hannah's age canonically?",Templates
tag classification,"what do you think about the update?my opinion:

1. multiwindow is nice!

2. the document scanfunction is quite interesting.

3. the darkmode is a first step but not more..I have good notes 5.2.3 for the Ipad. That cannot be the latest based on what I am reading here... I am not getting any updates......What gives? You have to apply for beta version:  [https://docs.google.com/forms/d/e/1FAIpQLSckB6gqTrca1Qr7BNPZOkp1E4oMuHlRG4X91BcjJp2xacJTyQ/viewform](https://docs.google.com/forms/d/e/1FAIpQLSckB6gqTrca1Qr7BNPZOkp1E4oMuHlRG4X91BcjJp2xacJTyQ/viewform) Thanks.",Review
tag classification,"Good grief the shape recognition in this app is awful.Draw shapes using the normal pen and holding down a finger while you draw Damn man, thank you so much!! For a paid app, this is for sure the shittiest shape recognition I've ever seen, let alone some other bugs and annoying stuff. I have to say those are some of the prettiest summation signs I’ve ever seen",Review
tag classification,"is it possible for the top part of the paper not to be fitted onto the screen?is it possible for gn not to zoom my paper when i  zoom it out and let it go? sometimes i just want to see the entirety of its paperHi, I tried to message you not sure if it worked? I'm in desperate need of help with this yahoo stuff, I can't find anywhere how to get back into an account. it won't let me comment on your other post and none of your links will work :( sos please!! hello im sorry i dont have the link anymore :( it was taken down by the website but iirc i had to go and email this sort of complaint website? thats not just for yahoo. im sorry i cant remember the specific name. Hello! I'm sorry for all those who were asking me, I didn't get to see some messages until today. The blog post I originally posted here that helped a few of you recover emails (such as I did) seems to be taken down by the owner. However here's the steps I can remember taking. 

1. Head on to [link](https://www.bbb.org/consumer-complaints/file-a-complaint/get-started)
2. Click company's privacy policies &gt; search yahoo &gt; choose the first one that comes up &gt; choose the one addresses in california
3. Fill out the remaining of the forms

An email should be sent to you two-three days after from a higher executive of yahoo. I'm not sure if this still works but it's worth a shot

good luck!",Question
tag classification,"LagI use a 2020 ipad Pro and I am experiencing lag in goodnotes along with the app closing abrupty.Did anyone else experience the same thing.?I have an iPad Pro 11 and noticed recently it’s been at least glitchy but so far it hasn’t closed out on me. It does like lag/glitch sometimes when I move a “sticky note” image around a page. That’s it so far for me! I'm on an iPad mini 4, and it does tend to lag when I'm about an hour into notetaking. Usually fixed when I close out the app and reopen. I think it’s probably your ram. So like memory for apps and stuff. The apps can take it up too. Make sure all other apps but GoodNotes or one more are closed. And try turning off and on your iPad, or restarting your iPad.",Question
tag classification,"Problems with adding page to outline &amp; favouriting pageWhen I add a page to outline... it is successfully added, but after I select that page from the document outline, it gives me a different page within the same document instead. Sometimes it's a few pages later, sometimes it's a few pages earlier. This happens with more than one of my documents. Does anyone else experience this? How can I fix this or can I send in feedback to the goodnotes team?

When I favourite a page... my screen jumps to the next closes page that's outlined, and the page that i'm trying to favourite isn't favourited.

Version: 5.4.17 (latest update), noticed the outline problem before this update but didn't know where to send in feedback.There should be a option within Goodnotes to send an email to the Goodnotes team for them to take a look at this issue you're experiencing.",Question
tag classification,"Anyone know how to fix this issue? Whenever I want to paste something, it ends up highlighting most of the page except for that section on the right side. I created this template using Goodnotes, exported it as a pdf and imported it to the templates.The lines you added are still selectable... when you long press on them, GoodNotes will select them like it will select text in a PDF you import with a long press.

To avoid it, open the exported PDF on your conputer, and save it as PDF again. Then add it to the templates library in GoodNotes. Sounds weird, but works.",Question
tag classification,"Black and Whitelines paper!!I found the best black and white lines paper ever, Its not really straining on the eyes as some black paper can be. This person made these templates perfectly. Go check them out.

[https://www.etsy.com/shop/EmilyStudying?section\_id=29424946](https://www.etsy.com/shop/EmilyStudying?section_id=29424946)Thanks Brush teeth Tumble Die, the one where the guy gets stuck in an industrial dryer that starts running",Templates
tag classification,"I take my notes in GoodNotes and when I make it a pdf it begins to look scratchy at the ends. How can I change this?Use abode PDF viewer, it depends on the pdf rendering engine. When you write the notes and then export them as a PDF where are you viewing them? I'll test this myself and submit a ticket to the beta team, but I need more detailed clarification. I wrote my notes export them into my files on my iPad then I submit them on canvas",Question
tag classification,"Extra space when PDF importI’m looking into getting GoodNotes for my iPad, but I have a specific requirement. 
I have a bunch of notes on lined paper that I want to scan and put into GoodNotes. But the biggest requirement is that I need to add to the existing notes. 
In most cases I can’t add another page, because it won’t be inline with everything. So I need to make sure I can write outside of the PDF margins or add space. 
Since the PDF is going to be my main notes I don’t want it to end up being really small when I place it. 
Can GoodNotes do this? If not any recommendations?Rather than scanning as pdf -use the camera in GoodNotes.  Take a photo and add the image to a page.  You can then scale it to the size you want with space on the side and bottom.  Remember that you can zoom in if the text is not as big as you want it - this is how I do it.  You can also write all over the image and use the highlighter on the image Thanks for the help! The reason I thought about scanning is because I’d like to have that clean look. I worry if I use camera it will have shadows or the quality won’t be as good. 
Can I not do all those things you listed but with a pdf? Size it, write over imagine and highlight? Hi. Just tried it and the answer is no.  When you import a pdf it creates a GoodNotes page and you cannot scale it.  You can scan using good notes and if the scan is a different size to the page, I.e. smaller then you have the space around the scan, but again you cannot scale it. Hope this helps",Question
tag classification,"How much notes do you have and how much space does it all take up?I want to buy an IPad Air 4 so I’m deciding if I should go for the 64GB or the 256GB64 gb should be plenty if you are only storing notes and not downloading many big files like Netflix TV series or movies onto your iPad. However, if money is not an issue, I’d recommend 256 gb to be on the safe side. I use it for school. I have 32 GB on my iPad and still have about 10GB that are unused. I however, always export my notes at the end of the semester and delete it ob GN itself, simply because I do not need to look at them frequently and if I do I can always reimport them in the next semester. So it really depends on your use. I have the 64 GB Air 3, I’m using 55 GB and I have it since the summer of 2019. I’m a college student (STEM), GoodNotes is taking up 5.25 GB and I’ve never exported and then deleted any GN notebook. The rest is pretty much photos and then procreate.",Question
tag classification,Planner helpI’m starting my fall semester in a week and I’m trying to get into the habit of keeping a digital planner. How do I get started and what are templates that you guys use? I checked out the templates on GoodNotes but they don’t seem efficient?EmmaStudies has some good templates on Etsy! I highly suggest looking there. It’s amazing what people have come up with! Check out PlanPlanStudio! I personally use one from their Etsy shop and I love it a lot You can try searching in this subreddit. People usually post their creations. I personally found [this ](https://www.reddit.com/r/GoodNotes/comments/i2z6xq/made_simple_monthlyweekly_planners/?utm_source=share&amp;utm_medium=ios_app&amp;utm_name=iossmf) very helpful!,Question
tag classification,"Someone please tell me what this little guy (next to text box) does. I cannot figure it out!It’s a laser 😊 click it. Your pencil will be a red dot when dragged on the screen I’ll be darned. That adds up! I never wanted to ask, but TIL what that icon actually does. Thanks for your question, OP! 🤣 Haha! No problem. I couldn’t hold the wonder in any longer 😆",Question
tag classification,"disable Double Tap gestureHi,

is there a possible way to disable the double tap gesture for erasing previously written things? I keep accidently erasing my written text with my hand.
Thanks for your answers!I haven’t found a way to disable it yet, but I’m dying for this feature. Go to the settings app, search for apple pencil and customize it to your liking. Hope it helps! This worked for me too. Thanks!",Question
tag classification,"Anything to keep in mind before buying a digital student planner/recommendations?I’m shopping on Etsy rn for a student planner for the first time and just wanted some tips or recommendations :)Life Planner by Breezy Organization or any of the dark mode planners by Foanse. Trangsadventures on YouTube and Instagram made a planner that’s free. Maybe check that one out first before you buy one and see if you like it! 

Here’s the link! 

https://www.dropbox.com/sh/qq2afaeessl87lo/AABSXPJX_axSnDuKU7hLSYvta?dl=0 I spent a lot of time on Etsy looking for one I liked and finally ended up just making my own. I found a really great website that shows how to make one using Keynote (it’s is similar to PowerPoint if you haven’t used before). It took me less than an hour. If you can’t find something you like I would consider making one yourself!",Templates
tag classification,Highlighting issueDo you have the same fonts installed on your Mac and iPad? There are slight differences with the fonts on different devices that are causing movement of the text which likely explains what you are seeing here i can double check that but on mac i set it as Times New Roman which i think is already a font in the app? thank you for the suggestion.,Question
tag classification,"Windows pcHow do I transfer my notes from my iPad to my desktop PC? I really want to but as far as I know, the app Is only available for MacI think the only way may be to export them as a PDF from GoodNotes and then view them on your PC. In GoodNotes you can have a cloud backup, I have my notes backup to google drive then the ""Backup and sync from google"" program installed on my desktop pc which automatically keeps the latest copy of all the notes downloaded in a folder. Backup your notes onto google drive",Question
tag classification,"Anyone know a keyboard shortcut for increasing/decreasing font size (on iPad pro) using an external keyboardI just bought the Logitech mx master keys for use on both my iPad and my Mac. I’ve been trying to increase the font size before actually writing something. I know there’s a shortcut where you press command +\= but it only works if the text is selected.
Anyone have a tip for me so that I don’t have to use the touch screen when using a keyboard? I tend to increase and decrease the font size a lot honestly and it ruins the flow especially if im in a lesson.
ThanksHe was a 4 year college player, that might be it Yeah I’ll add you I want it",Question
tag classification,Why are my writing look like this? I'm using a Apple pencil gen1Ayton also won’t foul out in 5 minutes like Nurkic stupidity after like 3 days but her face lit up and she said she loved me back Being too judgmental and becoming disinterested in you after they said they wanted to get closer. Lack of communication is also a flaw to me.,Stylus problems
tag classification,"Storage used on iPad?Hey, sorry if this doesn’t belong here!

I’m most likely going to be buying an iPad for university (going into second year), and would use goodnotes. I’m just trying to figure out if 32 gb is enough, or if I’d need the 128. 

How much storage do your notes take up? I’d be sending pdfs regularly to my laptop bc I don’t want to risk losing them, so I’d be able to delete the notes from the iPad after finishing the course, section, or printing them out; I’d also only really be using it for notes, probably not even textbooks.

Thanks for the help!It depends what you want to put on it besides GoodNotes. I use my iPad for pretty much everything and luckily got a 128gb version. 

GoodNotes takes up a lot of storage, I used it to summarize my biology notes for my final exams in highschool and I think it uses a bit less than 1gb? But biology was only about 20 sites. 

If you add a lot of pictures, it get‘s very full soon, not going to lie! 

But if you‘d sent them to your computer anyways, maybe have an own harddrive - 32gb should be enough as well :) Thank you! I’m going to continue using word, excel, video streaming, etc. on my computer so it would really just be the notetaking and google I guess haha Ah, okay! In that case, 32gb are going to be enough, I think. And in worst case, there are still some free clouds, like OneDrive.",Question
tag classification,"App for fashion sketchesI tried using Goodnotes for quick fashion sketches. Can anyone recommend any alternative apps that would be better for this purpose? I want to try a bunch of options before committing all my sketch ideas to one app going forward ☺️Procreate? Thanks! I should’ve been clearer- I want somewhere built-in to collect the sketches, like the “notebooks” feature in GN. do you if procreate has something like that? Not the person who replied but on Procreate you can form groups called “Stacks” of your artwork! They aren’t notebooks but more like, as the name would suggest, a little stack of sketches. This feature makes it so that you can preview a couple of the pieces before opening the stack. Hope this helps!",Question
tag classification,"Weird lag recently, is it the app or my device? (iPad 6th Gen)I’ve been using GoodNotes 5 since it came out and there has always been some lag but the lag is just ridiculous recently. I’ll be hand writing my notes and whenever I zoom in or out it ALWAYS takes a few seconds (feels like 5 seconds) for the page to be in focus again.

Just wondering if it’s the app being weird or my iPad being too slow. My iPad is on iOS 12.3.1, has about 15gb/32gb of storage used, and I usually switch between GoodNotes 5 and 4 (I use both for split screen when needed), sometimes Safari, when doing my notes.I've had this sort of lag since upgrading to GN5.  It is so bad I've stopped using it entirely. Does anyone from Goodnotes every reply to these threads?  It seems like a common issue.",Question
tag classification,"handwriting recognitionDumb question, but does GoodNotes not recognize handwritten numbers? Whenever I’m searching a number within my handwritten notes, it never comes up. I think I write my numbers pretty neat but it rarely ever recognizes it.. Are handwritten numbers just not supported?Ok I just did a test for numbers and searches.  When I search for a single number like 1 or 3 nothing comes up.  I searched for a word next to the number - and it does recognize it as a number.  i.e.

1 love - search for 1 doesn't find it.  Search for love and the 1 shows up converted in the search.  So it definitely finds and transcribes numbers.

So then I tried writing a 12 as neatly as possible - boom it shows up - so somehow a single number or letter search doesn't work.  I also tried searching for the letter ""a"" - and that turned up nothing but ""an"" showed a bunch.

So maybe try writing 01 02 and 03 - I did that and the search found those.  And TBH I was doing my date numbering using Art Deco style - which look look cool but I didn't think handwriting recognition would find it.  But It did as long as I searched and had 2 numbers.",Question
tag classification,"anybody know what to do? has happened multiple times now, don’t know how to fix it tho. support isn’t responding eitherIs your storage full? still got 170 gb free and iCloud storage isn’t full as well",Question
tag classification,"Considering buying the appHi guys I’ve been considering getting good notes 5 for a while now. Is there any reason to get it over what I’ve been using which is a combination of OneNote and PDF Expert. The reason I’m considering another app is because the export function has been a pain recently for my calculus notes. So what do you guys think, are there any major differences between the apps?I own both good notes and notability and like notability better. It is definitely worth it to buy the app, I have hardly used good notes but I’m okay with that since I’ve got so much value from notability and would have bought it ten times over. 

I’d say look more into notability and go for whichever takes your fancy, you won’t regret it :) Appreciate the reply. Think I’m gonna check out notability, specially since it’s on sale I cant speak for notibility because I don’t own it, but I do own goodnotes and I love it, there’s so much to do and a lot of freedom, that being said don’t get too overwhelmed it takes a bit of practice to ge to your favorite note taking paper and pen! I’d say it’s worth it, makes my school life a lot easier",Question
