prefix,input_text,target_text
tag classification,"GoodNotes 5 CrashingMy GoodNotes app keeps crashing whenever I try to open a new textbook file on the app. Anyone else experiencing this? It’s super frustrating.Thank you! I’m not tryna defend nm or anything I’m just hoping they do go forward and improve how we want them too but.

They literally are addressing the issue with content by adding content that they just showed off lol



Also i don’t understand the netmarble and Diane points can you elaborate more on those?

Also people can be hype for something we don’t have to always be angry at everything we can be hype and excited for the great things they do but still hold them accountable for the bad and hope they fix them no sense going through this game and it’s changes with a pissed off attitude He's just on loan from Darvish",Review
tag classification,"Apparently this feature of points on shapes came out in Sept 2020 but I only just noticed it and now can’t live without it! Always late to the party...How did you get the points to show up? Lol I feel like that’s what I’ve been missing. Once you’ve turned it into a shape (by holding down pencil) you tap on it with your finger and the points come up :) Perfect, thank you!",Review
tag classification,"Finally... GoodNotes 5! Did I miss anything in this video? Tried to point out all the ""new"" features.Man i imagined you would be a lot more popular in this sub. Love your channel :)  Thank you :)",Review
tag classification,"Been using GoodNotes for over a year now and just decided to spice up my notetaking from my old boring style. What do you think?I drew the headers on GoodNotes because I’m too lazy to do it on Procreate lmao I did this exact thing and once my notebook got big enough the app shit itself. Hopefully they fixed that so you don't experience the same issue. Oh no! That worries me, although I’ve done this style for a couple of pages only. When did that problem occur for you, was it recent?",Review
tag classification,"Goodnotes is awful on macbookMan, Goodnotes is absolutely terrible on macbook when taking notes with my graphics tablet. Like disgustingly slow. I don’t have an ipad to use this on so I am just so disappointed I paid 10$ for the app.

Note: I tested my tablet in free web browser “whiteboards” and it works totally fine with those, so I know the graphics tablet &amp; pen is not the issue.Yeah GoodNotes is an iPad app that they just copied onto the MacBook so people can access their files from there. Depending on where you live and when you purchased GN you can still ""return"" it and get your money back. (2 weeks in the EU, check if your country has something similar) I love GoodNotes but I cannot agree with you more. The Mac port is a lacklustre attempt at best. It has had zero max specific workflow thought go into it and is in my opinion a missed opportunity. Yes I agree with everyone. That’s just an handy port to consult your documents on the Mac but it has zero look and feel of the Mac.",Review
tag classification,"‎If you want to improve your handwriting on iPad, the app Writey has gone from $1.99 to FREE and it helps you to practice writing in cursive and print!thank you thank u!! do u know if this is a permanent price change or a special? I get my ipad tomorrow 😗 no worries! I think it might be a special but it should still be free by the time you get your iPad!",Review
tag classification,i’m fairly new to houseplants so i decided to read up about my plants today and here are the notes i took 🖤 i’m in love with the mix of brush and fountain pens!I love this! thank u!! 🖤 I've had house plants and usually kill them. Now during quarrentine I'm determined to let them live this time. What would you recommend for resources?,Review
tag classification,"First Attempt With GoodNotes! Any thought?Nice color scheme! I recommend using the square paper to make your words even neater :) Is square better than dot grid? I’m always confused by which one to use Personally I always use square, like I try to fit my word into for example a full grid for the subtitle and 2/3 of a grid for body text, etc. It helps align both the size of your letters and also make you write in a straight line!

Also I change the template back to blank so it looks ""cleaner"" haha",Review
tag classification,"How I Make Effective Notes with GoodnotesAre those two different po' boys or one with roast beef and shrimp?  The combo sounds like it could work Done, please upvote my Pinned Post! Oh please! join r/banglaAudiobook you've been recruited",Review
tag classification,"what do you think about the update?my opinion:

1. multiwindow is nice!

2. the document scanfunction is quite interesting.

3. the darkmode is a first step but not more..I have good notes 5.2.3 for the Ipad. That cannot be the latest based on what I am reading here... I am not getting any updates......What gives? You have to apply for beta version:  [https://docs.google.com/forms/d/e/1FAIpQLSckB6gqTrca1Qr7BNPZOkp1E4oMuHlRG4X91BcjJp2xacJTyQ/viewform](https://docs.google.com/forms/d/e/1FAIpQLSckB6gqTrca1Qr7BNPZOkp1E4oMuHlRG4X91BcjJp2xacJTyQ/viewform) Thanks.",Review
tag classification,"Good grief the shape recognition in this app is awful.Draw shapes using the normal pen and holding down a finger while you draw Damn man, thank you so much!! For a paid app, this is for sure the shittiest shape recognition I've ever seen, let alone some other bugs and annoying stuff. I have to say those are some of the prettiest summation signs I’ve ever seen",Review
tag classification,Notes from today looking nice if I do say so.I love it! So satisfying. What template do you use? Standard notebook size. Letter in white I love your cap E looks like an epsilon 🤤,Review
tag classification,"Ram mangement is trash!The ram management of the GoodNotes Mac App is trash, it never releases any of the Ram it takes if you don't quit the application manually, even if you close taps or document. It easily takes 2-3 GB of ram on my 8GB M1 MacBook Air. (I know the performance is trash on Intel Macs as well but it is actually usable on Apple silicon) 

This is not an issue on iPads because the iPadOS handels Ram differently. There, the least needed app is just removed from Ram completely when ram is needed (with no mercy). MacOS has more mercy which it honestly shouldn't have when there are a lot of apps that don't handle ram responsibly, like GoodNotes and Notability.Mommy!!! 🤤 Did AA at West Point 2 years ago. It was like 11 days or so? 

There will be a timed layout early on. Make sure you bring everything and organize everything the way it should be. You will be given a paper on how everything should look like before then. I practiced the night before just to be safe. Seen lots of people get dropped for stupid stuff like forgetting a pen and stuff like that. Don't be that guy/girl.

There are some things you need to have on you at all times.. During formations, black hats will likely ask you to pull said things out. Forgetting these things gives you gigs. Like 4 gigs will get you dropped?

There will be written tests that are pass/fail. Study forsure, but I dont think a single person failed, so I wouldn't worry. Quizlet is a good tool.  

 I'm really stretching my memory, but hopefully it gives you an idea. Before the obstacle courses you will do a 2 mile run in boots. The cut off time is like 18min? I witnessed like 10 people fail. I got second hand embarrassment from that so please don't fail....

There are major obstacles and minor obstacles. Failing 2 minors you will be dropped? Failing a major one will get you a drop. If you functionally are fit, these obstacle courses are pretty easy imo. Be good at climbing a rope, do some pullups, commit to whatever you're doing, and you'll be fine. 
Confidence climb can make tricky if youre short. You should be able to climb up easily, but the last 2-3 bars are spaced out farther than the others. If youre not afraid of heights take your time. Ive seen a short girl spend like 15 mins at the very top, figuring out how to get down and she eventually got it. There will be a line of people probably looking at you in case that worries you. I haven't seen anyone not get it so you'll be fine!

The really only hard part are the sling load inspections. Thankfully you are doing it at west point because they leave the stuff out so you can practice unlike Campbell (from what I heard). Fucking. Practice. I personally thought it wasnt that bad, but like a quarter of the people in your class will fail because of this. I practiced probably a total of like 5-6 hours to memorize my sequence for reference.

After that there is the repelling part. A hand signal test. And I cant remember from here. Honestly wouldnt worry at all aside from the layout and sling loads. 
 You'll finish the course with a 12 mile ruck (25 lbs) and I think a final layout. Course is relatively flat, but there is a steep incline for a short part of it. 

Dont stress too much. There will be a lot of free time. I was on Netflix for like half the day lol. Barracks may or may not be disgusting, depends on if you've had a good life or not. 

I am a cadet at WP so obviously I had a huge advantage going in, but come fit and focused and youll be good to go.

Lemme know if you got any questions. What up",Review
tag classification,"Artists’ support, I created an art journal on GoodNotes 5! Subscribe if you like it!Dont worry sir im ready for use. Dm me master Aggressively average If I described it out of context it'd probably sound like a goofy Mr. Bungle type joint but, no, its unorthodox parts come together to make a totally coherent and masterful symphonic black metal release. RIP Baron Blood.",Review
tag classification,"GoodNotes 5 CrashingMy GoodNotes app keeps crashing whenever I try to open a new textbook file on the app. Anyone else experiencing this? It’s super frustrating.Thank you! I’m not tryna defend nm or anything I’m just hoping they do go forward and improve how we want them too but.

They literally are addressing the issue with content by adding content that they just showed off lol



Also i don’t understand the netmarble and Diane points can you elaborate more on those?

Also people can be hype for something we don’t have to always be angry at everything we can be hype and excited for the great things they do but still hold them accountable for the bad and hope they fix them no sense going through this game and it’s changes with a pissed off attitude He's just on loan from Darvish",Review
tag classification,"Apparently this feature of points on shapes came out in Sept 2020 but I only just noticed it and now can’t live without it! Always late to the party...How did you get the points to show up? Lol I feel like that’s what I’ve been missing. Once you’ve turned it into a shape (by holding down pencil) you tap on it with your finger and the points come up :) Perfect, thank you!",Review
tag classification,"Finally... GoodNotes 5! Did I miss anything in this video? Tried to point out all the ""new"" features.Man i imagined you would be a lot more popular in this sub. Love your channel :)  Thank you :)",Review
tag classification,"Been using GoodNotes for over a year now and just decided to spice up my notetaking from my old boring style. What do you think?I drew the headers on GoodNotes because I’m too lazy to do it on Procreate lmao I did this exact thing and once my notebook got big enough the app shit itself. Hopefully they fixed that so you don't experience the same issue. Oh no! That worries me, although I’ve done this style for a couple of pages only. When did that problem occur for you, was it recent?",Review
tag classification,"Goodnotes is awful on macbookMan, Goodnotes is absolutely terrible on macbook when taking notes with my graphics tablet. Like disgustingly slow. I don’t have an ipad to use this on so I am just so disappointed I paid 10$ for the app.

Note: I tested my tablet in free web browser “whiteboards” and it works totally fine with those, so I know the graphics tablet &amp; pen is not the issue.Yeah GoodNotes is an iPad app that they just copied onto the MacBook so people can access their files from there. Depending on where you live and when you purchased GN you can still ""return"" it and get your money back. (2 weeks in the EU, check if your country has something similar) I love GoodNotes but I cannot agree with you more. The Mac port is a lacklustre attempt at best. It has had zero max specific workflow thought go into it and is in my opinion a missed opportunity. Yes I agree with everyone. That’s just an handy port to consult your documents on the Mac but it has zero look and feel of the Mac.",Review
tag classification,"‎If you want to improve your handwriting on iPad, the app Writey has gone from $1.99 to FREE and it helps you to practice writing in cursive and print!thank you thank u!! do u know if this is a permanent price change or a special? I get my ipad tomorrow 😗 no worries! I think it might be a special but it should still be free by the time you get your iPad!",Review
tag classification,i’m fairly new to houseplants so i decided to read up about my plants today and here are the notes i took 🖤 i’m in love with the mix of brush and fountain pens!I love this! thank u!! 🖤 I've had house plants and usually kill them. Now during quarrentine I'm determined to let them live this time. What would you recommend for resources?,Review
tag classification,Why are my writing look like this? I'm using a Apple pencil gen1Ayton also won’t foul out in 5 minutes like Nurkic stupidity after like 3 days but her face lit up and she said she loved me back Being too judgmental and becoming disinterested in you after they said they wanted to get closer. Lack of communication is also a flaw to me.,Stylus problems
tag classification,"Lag while using Apple Pencil, anyway to solve this?How old is you iPad? How many pages does that notebook have? If it's not blank, does that happen in blank notebooks? This is the first page of a new workbook. My iPad is iPad Pro 9.7” from 2016. The Apple Pencil works fine on the iOS notes... only showing issues on good notes Hmm. I'd try uninstalling and installing again and probably unlink and link the pen, just in case, but it definetively looks like a Goodnotes bug",Stylus problems
tag classification,"GoodNotes file size is heavily affected by chosen pen styleFor those of you who are wondering why your files are so big even without pictures: 

For example using the fountain pen instead of ball pen increases my file size from 1MB to nearly 6MB! Tested it with a full written A4 letter. I guess the reason for this is that GoodNotes has to assign a different pressure value/thickness to each inked position/pixel. I think every user should know this.Yeah I asked exactly this recently, then I tried writing the same (sufficiently long) text in two different files one with the ballpoint pen and the other with the fountain pen, and I found the second one to be 5 times the size of the first (I checked the size of the *.goodnotes files backed up on google drive) Was wondering why a 12 page notebook was taking 37 mb myself, this helped. Thanks! That explains a lot. Thanks.",Stylus problems
tag classification,"Highlighter issueI keep having this same problem on GoodNotes. When I export my page into a PDF, the highlighter part always looks weird like in the image I posted. It doesn't look like that on the app itself, just when I export it. I'm not sure how I can fix it. Thanks!Just realized the picture did not upload. Here it is: [https://i.imgur.com/AlaTRjL.png](https://i.imgur.com/AlaTRjL.png)",Stylus problems
tag classification,Why are my writing look like this? I'm using a Apple pencil gen1Ayton also won’t foul out in 5 minutes like Nurkic stupidity after like 3 days but her face lit up and she said she loved me back Being too judgmental and becoming disinterested in you after they said they wanted to get closer. Lack of communication is also a flaw to me.,Stylus problems
tag classification,"Lag while using Apple Pencil, anyway to solve this?How old is you iPad? How many pages does that notebook have? If it's not blank, does that happen in blank notebooks? This is the first page of a new workbook. My iPad is iPad Pro 9.7” from 2016. The Apple Pencil works fine on the iOS notes... only showing issues on good notes Hmm. I'd try uninstalling and installing again and probably unlink and link the pen, just in case, but it definetively looks like a Goodnotes bug",Stylus problems
tag classification,"GoodNotes file size is heavily affected by chosen pen styleFor those of you who are wondering why your files are so big even without pictures: 

For example using the fountain pen instead of ball pen increases my file size from 1MB to nearly 6MB! Tested it with a full written A4 letter. I guess the reason for this is that GoodNotes has to assign a different pressure value/thickness to each inked position/pixel. I think every user should know this.Yeah I asked exactly this recently, then I tried writing the same (sufficiently long) text in two different files one with the ballpoint pen and the other with the fountain pen, and I found the second one to be 5 times the size of the first (I checked the size of the *.goodnotes files backed up on google drive) Was wondering why a 12 page notebook was taking 37 mb myself, this helped. Thanks! That explains a lot. Thanks.",Stylus problems
tag classification,"Highlighter issueI keep having this same problem on GoodNotes. When I export my page into a PDF, the highlighter part always looks weird like in the image I posted. It doesn't look like that on the app itself, just when I export it. I'm not sure how I can fix it. Thanks!Just realized the picture did not upload. Here it is: [https://i.imgur.com/AlaTRjL.png](https://i.imgur.com/AlaTRjL.png)",Stylus problems
tag classification,Why are my writing look like this? I'm using a Apple pencil gen1Ayton also won’t foul out in 5 minutes like Nurkic stupidity after like 3 days but her face lit up and she said she loved me back Being too judgmental and becoming disinterested in you after they said they wanted to get closer. Lack of communication is also a flaw to me.,Stylus problems
tag classification,"Lag while using Apple Pencil, anyway to solve this?How old is you iPad? How many pages does that notebook have? If it's not blank, does that happen in blank notebooks? This is the first page of a new workbook. My iPad is iPad Pro 9.7” from 2016. The Apple Pencil works fine on the iOS notes... only showing issues on good notes Hmm. I'd try uninstalling and installing again and probably unlink and link the pen, just in case, but it definetively looks like a Goodnotes bug",Stylus problems
tag classification,"GoodNotes file size is heavily affected by chosen pen styleFor those of you who are wondering why your files are so big even without pictures: 

For example using the fountain pen instead of ball pen increases my file size from 1MB to nearly 6MB! Tested it with a full written A4 letter. I guess the reason for this is that GoodNotes has to assign a different pressure value/thickness to each inked position/pixel. I think every user should know this.Yeah I asked exactly this recently, then I tried writing the same (sufficiently long) text in two different files one with the ballpoint pen and the other with the fountain pen, and I found the second one to be 5 times the size of the first (I checked the size of the *.goodnotes files backed up on google drive) Was wondering why a 12 page notebook was taking 37 mb myself, this helped. Thanks! That explains a lot. Thanks.",Stylus problems
tag classification,"Highlighter issueI keep having this same problem on GoodNotes. When I export my page into a PDF, the highlighter part always looks weird like in the image I posted. It doesn't look like that on the app itself, just when I export it. I'm not sure how I can fix it. Thanks!Just realized the picture did not upload. Here it is: [https://i.imgur.com/AlaTRjL.png](https://i.imgur.com/AlaTRjL.png)",Stylus problems
tag classification,Why are my writing look like this? I'm using a Apple pencil gen1Ayton also won’t foul out in 5 minutes like Nurkic stupidity after like 3 days but her face lit up and she said she loved me back Being too judgmental and becoming disinterested in you after they said they wanted to get closer. Lack of communication is also a flaw to me.,Stylus problems
tag classification,"Lag while using Apple Pencil, anyway to solve this?How old is you iPad? How many pages does that notebook have? If it's not blank, does that happen in blank notebooks? This is the first page of a new workbook. My iPad is iPad Pro 9.7” from 2016. The Apple Pencil works fine on the iOS notes... only showing issues on good notes Hmm. I'd try uninstalling and installing again and probably unlink and link the pen, just in case, but it definetively looks like a Goodnotes bug",Stylus problems
tag classification,"GoodNotes file size is heavily affected by chosen pen styleFor those of you who are wondering why your files are so big even without pictures: 

For example using the fountain pen instead of ball pen increases my file size from 1MB to nearly 6MB! Tested it with a full written A4 letter. I guess the reason for this is that GoodNotes has to assign a different pressure value/thickness to each inked position/pixel. I think every user should know this.Yeah I asked exactly this recently, then I tried writing the same (sufficiently long) text in two different files one with the ballpoint pen and the other with the fountain pen, and I found the second one to be 5 times the size of the first (I checked the size of the *.goodnotes files backed up on google drive) Was wondering why a 12 page notebook was taking 37 mb myself, this helped. Thanks! That explains a lot. Thanks.",Stylus problems
tag classification,"Highlighter issueI keep having this same problem on GoodNotes. When I export my page into a PDF, the highlighter part always looks weird like in the image I posted. It doesn't look like that on the app itself, just when I export it. I'm not sure how I can fix it. Thanks!Just realized the picture did not upload. Here it is: [https://i.imgur.com/AlaTRjL.png](https://i.imgur.com/AlaTRjL.png)",Stylus problems
tag classification,"Free Hyperlinked A4 Notebooks (5 Tabs) - Link in comments![removed]  Hi guys! I made 2 free digital notebooks for download. Both are A4/portrait/hyperlinked. Here's the download link:

[https://drive.google.com/drive/u/2/folders/13F3Qu\_oMMr6\_NjHWJpAg67rKuHiarlPE](https://drive.google.com/drive/u/2/folders/13F3Qu_oMMr6_NjHWJpAg67rKuHiarlPE)

I'm planning on selling planners and notebooks in the future. But as practice, I created these two for free.

Please let me know what you think about the notebooks! Also, what templates are most useful to you? Are there specific planner spreads that you need but rarely find? I might make more stuff to give away so I'd really love your opinion! Clean and simple, thank you",Templates
tag classification,"ISO template in light modeThat’s a great way to look at it. Thanks! Arkadaşım, hiçbir kadın vajinası olup östorojen salgıladığı için öldürülmüyor. Öldürülmelerinin sebebi yetiştikleri kültüre veya partnerlerinin veya ailelerinin kültürüne göre onları rezil ediceklerini düşündükleri şeyler yapmaları ya da kız arkadaşlarının/eşlerinin  ayrılmasını kendine yediremeyecek kadar şerefsiz olması. Hedefi doğru belirlemiyorsunuz feministler olarak ben feminizm hakkında bir sürü insanın görüşüne danıştım ve bir sürü kaynağa da baktım. Yani yazacak çok şeyim var. Hedefi doğru belirlememe konusuna geliyorum, şimdi 10 çocuk düşün hepsi şişman ve hepsinde zeka geriliği var. Bu çocukları bir teste soktuk ve hepsi başarısız oldu. Başarısızlıklarının sebebi olarak şişman olmalarını gösterirsem tam da senin yaptığın şey olur. Oysaki başarısızlıklarının sebebi zeka geriliği olması. Şimdi konumuza dönelim 10 erkek düşün, bunların hepsi eşlerini veya bir aile üyesini kültürüne uymadığı için öldürmüş kişiler olsun. Bunların kötü olan özelliği erkek olmaları mı yoksa bok gibi kültürlerde yetişmiş ve bunu benimsemiş olmaları mı? Türkiyede feminist olduğunu iddia edenlerin de yarısı erkek düşmanı. Ben senden daha az eğitimli 100 kişiyle tartışmış olsam bunlardan 50 tanesi feminist gibi geçinen erkek düşmanları. Tarihte onlara eziyeti ben çektirmedim onlara ama benim gibi insanlardan intikam almaya çalışıyorlar gibi oluyor. oh so is there a reason you couldn't have just answered the question without being rude about it? ""YoU kNow ThAt PLENTY oF fAnS.."" if I knew that, would I have asked this? lmao did I offend you by not knowing every detail? 

also, your math is pretty off. Hannah is 3 when they're captured? 10 where we are now? that's 7 years... June's journey is 2 years + 2 years = 4 years , plus 8 months?

so.. 4 years and 8 months don't exactly close the gap. where does it ever say Hannah's age canonically?",Templates
tag classification,"Black and Whitelines paper!!I found the best black and white lines paper ever, Its not really straining on the eyes as some black paper can be. This person made these templates perfectly. Go check them out.

[https://www.etsy.com/shop/EmilyStudying?section\_id=29424946](https://www.etsy.com/shop/EmilyStudying?section_id=29424946)Thanks Brush teeth Tumble Die, the one where the guy gets stuck in an industrial dryer that starts running",Templates
