prefix,input_text,target_text
tag classification,"I haven't had GN4 and I‘m wondering if I should go with the GN5 bundle or just buy GN5 as is.Hey there! I've been hearing a lot about GoodNotes and since I've finally upgraded to an iPad Pro where my Pencil works well, I was wondering if it's better for me to get the GN5 bundle (the one where I pay for GN4 and download GN5 for free) or go straight to paying for GN5?

I saw how buggy GN5 is, seeing how it's still in beta, and thought of opting out to GN4 in the meantime until the bugs are fixed.Probably a better option to go with Notability seeing as the issues still haven't been fixed months after the release... GN4 has its own issues that may or may not effect you. I’d just hard pass on the lot and look elsewhere. 

There’s no point getting used to the workflow of a deprecated piece of software (GN4) hoping that GN5 will become usable at some point. 

GN5 not in beta though, it’s released and people have paid for it. 

Notability, Note Shelf 2 are two reasonable alternatives to investigate. There are others but those are the ones I’d recommend.  I’m a long time GN4 user and didn’t have any problems with it. GN5 has its problems, probably released too early, but they are working hard to address them. 
GN beats Notability in the way notes are organised and the ease of creating new papers - I like notability for its ink and pens, but the key to note taking is being able to find what you previously wrote. 
My advice, and only mine, would be to go with GN4 and give them a month or so to resolve the bugs, they are close now",Question
tag classification,How To Create a Digital Monthly Planner in Keynote || June 2021 Plan With Me25 degrees [removed] @harshalax31,Templates
tag classification,"Strange slashes in notes when exporting to PDF?Not sure if this has been resolved before but whenever I export my notes as a PDF the letters in some areas become sharp and inaccurate, haven't found a fix for this yet so was wondering if anyone has had a similar issue? For example the o in this image.

https://preview.redd.it/lo3ocy5huql51.png?width=358&amp;format=png&amp;auto=webp&amp;s=bdd8f9e5c4c33e964ea76415f396765b0f121d26I recall a similar question being answered in this subreddit. Not sure where it is now. I believe that it only happens with the ball point pen. To fix, you can use fountain pen. I also had problems with this but only in Google Drive. Opening the PDF in the Files app or another PDF reader had no problem.

Edit: Here is the post that had the same issue. Don't think it's resolved. [https://www.reddit.com/r/GoodNotes/comments/e53n9o/converting\_to\_pdf\_issue/?utm\_source=share&amp;utm\_medium=web2x&amp;context=3](https://www.reddit.com/r/GoodNotes/comments/e53n9o/converting_to_pdf_issue/?utm_source=share&amp;utm_medium=web2x&amp;context=3)",Question
tag classification,"PrintingWhen I’m printing my notes out, it doesn’t have much contrast anymore. I don’t think it’s an issue with my printer as it prints normal. It’s just when I’m printing handwritten notes it’s become faded. I’ve tried to add more contrast to the pdf before I print, but it doesn’t do any justice.

Any idea? 😕Try printing black only if you're using the color cartridge by default But I have color on my notes 😕 Maybe to check if it's your printer (just to make sure) take a screenshot of the page and print it. That way you know for sure whether it's the app or your printer. If it works you'll probably just have to screenshot your notes and crop them ://",Question
tag classification,"Battery draini’ve been using my ipadpro for no more than 2 months and thought it had a battery problem because it kept draining. but not i think its actually when using goodnotes that not only it drains the battery but it gets reaaaally warm. has anybody dealt with this? any suggestion? ps. the brightness of the ipad is not even to the maximum.Do you keep you pencil attached to the iPad when you aren't using it? I find that drains the battery pretty quick, so I only attach it when it needs charging - and it doesn't take long at all to fully charge. 

How long does your battery usually last if you're using your iPad and GoodNotes? From what I've been reading, a lot of users are having battery life issues since recent updates of the OS, not necessarily unique to GoodNotes, unfortunately.",Question
tag classification,Writing on the end of my imported slides is being cut off by the end of the slide. Does anyone know how I can maybe fix this cause this dosen't happen on the actual pdf?What was your process of importing the file? I opened the file from drive and then I just went top right corner and opened it into goodnotes. Is it still in the program file the slide was created in?,Question
tag classification,"How long does it take for you to complete a page of notes?Curious about this as I find it can take me anywhere between 2-5 hours to get a whole page done (A4) (or 1-3 hours for A3). 

I definitely find myself sacrificing productivity for concerns about aesthetics and fiddling around with minor layout/text size/whatever things, and it makes me wonder whether taking notes this way is actually worth the time I spend or not. How do you guys deal with this? Do you find with time you become quicker as you get used to setting out notes and finding a way that works for you? I've been using Goodnotes for a few months now, but not regularly (and prior to this I've never really taken notes before in my life lol) so I could just be needing time to find compromises and methods that work. 

Also, as a bit of a bonus q - how do you guys deal with not taking down too much unnecessary information as part of your notes? I find myself often copying almost entire pages/paragraphs from my textbook near word for word, rather than being able to effectively summarise information. If anyone has any links to guides on note taking I'd really appreciate them (not Cornell though :&lt; something about that style pisses me off even just thinking about it).

Hope you're all having a good day :)Aesthetic notes are pleasing to read later. I loved those notes too, but I think it they are the result of perfectionism. I make my notes only okay, with readable handwriting, some alignment of stuff/formulas/etc and some highlighting. That’s it. Rest is only our desire to make beautiful notes. If you’re wondering, I fill a Goodnotes standard paper in about 30 minutes. Would be 45 to 55 for A4. Don’t spend a lot of time decorating them. 
As for the copying, you don’t need to clone your textbook in a beautiful manner, the best way of taking notes is summarising. I don’t have any resources except for YouTube Videos by Ali Abdaal, Anas Nuur Ali, and KharmaMedic. 
Here’s a tip, in a language, you have some keywords and some grammar terms. Differentiating between them will help knowing what’s important and what’s not. Hi, hope you’re having a good day too! 

I use A4 size paper with the dark background, usually dotted or square template. 

I’ve been using GoodNotes for 3 year-ish. At the beginning, I took my notes very slowly because I tried to make it look pretty. But now, I went through pages pretty fast. 

What I did was simplifying the kind of notes i write. Instead of focusing on making it look pretty, I just wrote whatever quickly using 1 pen style, and highlighting / circling the important parts quickly. The organization of the notes is done when I’m going through them.

Basically, I’m treating it like a scrap paper that I can write anything on. 

Maybe this is something you want to consider? I took a lot of notes during class or with a recording going on (that I'll try not to pass if I can avoid it). This forced me to spend more time on writing stuff down rather than worry about the aesthetics. Especially, since I am going to have a bad handwriting anyway if I am writing fast.

Also using only 1-2 pen colour(s) while taking notes also helped because I can't really do much aesthetics while not changing pen style or colour. I would use s highlighter during revision to highlight important points.",Question
tag classification,"My Colorful CoversFeel free to download and share your feedback :) You, my friend are awesome!!! Absolute mad lad. Crazy good!",Templates
tag classification,"By popular demand, made a few free element packs. Link in the comments.[https://drive.google.com/drive/folders/1-3A2STpc\_PB1EW1kQCFVCf6KrE923DiC?usp=sharing](https://drive.google.com/drive/folders/1-3A2STpc_PB1EW1kQCFVCf6KrE923DiC?usp=sharing) Thank you!",Templates
tag classification,Notes from today looking nice if I do say so.I love it! So satisfying. What template do you use? Standard notebook size. Letter in white I love your cap E looks like an epsilon 🤤,Review
tag classification,"Matte screen bad for pencil ?Now i m using glass screen protector but its hard to write on screen.
So i decide to buy matte screen protector and i worry about mess it up my pencil tips . So do u recommend matte screen protector?Matte screens wear your pencil tips down faster. I went for the tip cover instead of a screen protector and I think it is OK. Not as good as the screen protector some would say in terms of writing itself(haven’t tried one on though). But it protects everything, less than half the price, decrease writing sound and gives a little friction to work with. For reference I got the pzoz tip cover white colour from aliexpress :P I think the matte screen protector is worth it. It makes it much easier to write on the screen and it basically eliminates the drag of my hand against the screen. I’ve been using my iPad for 3 years and I’ve only replaced the tip twice (and once was because I accidentally dropped my pencil and bent it). I don’t find the wear to be that significant personally.",Question
tag classification,"Black Hexagon (Chemistry) Template?Hi!! I’m still relatively new to the entire realm of the abilities of GoodNotes 5, but I’m an organic chemistry student and I would love to have a hexagon template for notes BUT I take my notes on black paper for the looks :/  Anyone have a black hexagon template they love in the normal portrait format? Also, if you have cute covers, I’d like some too. Thanks!!You could probably just use the dotted dark paper for that, I'm sure it would work out ok. You could always draw up a hexagon and keep it on a beginning index page, then copy and paste it whenever you need it. 

Side note: I took organic 1 and 2 and it was crazy interesting but also crazy difficult, I hope it's going well for you! Agreed, or just make a 'stickers/structures' notebook tabbed and copy and paste the structures in as you need them Thanks for the tip!! I didn’t think of using the dotted paper.",Templates
tag classification,"Print pdfHas anyone ever printed out a pdf of their good notes?
I know it kinda goes against the paperless point, but idk I like the idea of printing out my pretty notes and getting them spiral binded. 
Would you do that with any of your good notes? Or do you think it goes against the point?I think he will be too, but I’m in a full rebuild, that change it for you at all! Imagine you're about to do the do with your Furry SO, then a third Furry you didn't recognize comes out of your closet, screams at the top of his lungs, and runs back into the closet...but when you go to investigate, you just see an empty closet. 

How scared would you be? I love the little disclaimer they have.  Like they actually give a shit.  What a joke.",Question
tag classification,"I’m creating lines on goodnotes with the shape creating tool. For some reason, some of the lines are erasable and the others aren’t? The lines that don’t snap straight become permanent and can’t even be moved. Is there a setting I need to switch or something that I’m doing to cause it?This looks like a bug that the Goodnotes team needs to be made aware of. Send them a link to this video and show them . In the meantime  try using the selection tool to see if you can “activate” those lines and then try and delete them. I experienced this too but I have no idea what I was doing to make that happen. Definitely report this bug. I only managed to clear mine after clearing the entire page. The lines can’t even be selected. I’ll definitely be alerting them about it, thank you!",Question
tag classification,"Free Hyperlinked A4 Notebooks (5 Tabs)[removed]Glad you think so, just been having a look through your clit pump photos... Hot! Download link sent to DM That's more of a dissatisfied snarl",Templates
tag classification,"White Lines on Right and Bottom Edge on Custom Template?I have created a custom paper template by using the exact same dimension that GoodNotes paper uses (imported it into Affinity Designer and measured it vertically and horizontally). However, there are white lines present on the right and the bottom edge **only** when the paper is imported into GoodNotes. 

I have reached out to GoodNotes, but they haven't replied even after a month...",Question
tag classification,"any plans for a decent pencil brush on goodnotes?I'm an illustrator and animator, using Goodnotes for almost a year now for studies, note-taking, etc. I just don't find any of the three provided brushes useful for organic sketching, drawing or storyboarding. Apple Notes has a fantastic pencil brush that I am forced go back to time and time again. Does anyone know if a more organic pencil brush is coming on Goodnotes? I'd love to use one app only for everything, but I end up switching to Apple Notes for my work and using Goodnotes less and less.

Or maybe there's another app with a good pencil brush you could recommend? I can't seem to find any. I have many art textbooks or screenplays I annotate in Goodnotes already, it would be super helpful to be able to freely sketch on the margins of the books while I highlight the points those drawings are refering to. It would even replace Procreate in the storyboarding stage if the pencil brush were decent - I'd plan my animatic right where my script is, in one document. I end up drawing with highlighters, which is fun but not functional by any stretch of the imagination...Nvm found CollaNote on this subreddit - has many features I use in Goodnotes AND Apple Notes' pencil-like brush AAAND is free. I'll switch to that for a while there's an app which was recently released called collanote which is free and has a pretty damn good pencil Yup found it an hour after I posted this and became its beta tester. Pencil brush is perfect and it being free is so impressive. Can't wait to see what it becomes in the future! Thanks for the suggestion",Question
tag classification,"Easy way to include outline actually ON for example second page of a document?So outline works. That’s great as long as you stay on your iPad. Opening your outlined pdf (editable) export gives a neat overview of the chapters you’ve set, also when reading in Apple Books. 
BUT WHY DOES IT HAVE TO BE SO DIFFICULT ADDING YOUR OUTLINE EFFECTIVELY ON A PAGE. Did none of the devs really think of that or am I just missing something? 
Right now, I have to take a screenshot of the index in iBooks, return to my Goodnotes document, add the screenshot to page 2 or 3 to create an in-document table of contents... 

Seems crazy; is this the only way to do this?Yeah, that's pretty rough. Also, if trying to open the editable PDF on a Windows laptop, the pages tend to take a while to load due to being editable and (in Chrome PDF viewer) the bookmarks tend to be off by a page.

I've resorted to outlining my document as I write it out and then making a table of contents manually on the first page based on the outline. This allows me to export flattened but still know which page covers which concepts, etc.

Definitely takes a good three or four minutes for longer lecture notes (which can add up over time), but it's what works best with my academic workflow.",Question
tag classification,"Flash card shuffle?Is there a way to shuffle the flash cards or to scroll through the set? I love the ability to make them, but I hate how I can’t go back to the previous card when I’m in practice mode.I don't think there is unfortunately. The idea is that it will show you them in a semi random order with cards you found hard coming up more often. On another note, do your flash cards seem to be slightly low res? It's mostly fine on a larger screen like an iPad (although still noticeable), but on a phone screen smaller writing becomes fuzzy and almost unreadable. Yes! It’s better on my iPad for some reason. 
I’ve also been having issues with the notecards only giving me the option “again”, “good”, and “easy” there no in between again and good. Have you had that issue? Yeah I do, I think this feature must still be a work in progress - maybe a future update will fix it",Question
tag classification,"Download this for free! This is a 50-page 2021 digital planner for people who want to be productive. This template is simple and colourful. It's so great to be used on Goodnotes. ✨she wasn’t [](/lunahappy) Even after all these years, gamer Luna is a premise that I like (even if I do not consider myself as one). [deleted]",Templates
tag classification,"Text sizing issue - Does anyone know why these say two different numbers? It always does this and it screws up the sizing from my computer to my iPad. On my computer it does the same thing. Is it supposed to do this?Wait... you can get GoodNotes for the computer, too? Yes, if you have a Mac you can download it from the App Store. I’ve been having the same issue on iPad as well, super annoying!",Question
tag classification,"Using goodnotes as a regular BoJoI use goodnotes for my journal like many here. But I like to use it like a  BoJo on pen and paper with the goodness of digital notetaking.  For some reason using digital journal with click shortcuts gives an app like feel which takes away the feel of good old pen and paper.

Additionally, if anyone uses the app the way I do. Would be glad to exchange templates for journal.I sent you a DM :)",Question
tag classification,"Light vs Dark Templates - Which one do you prefer and why.The dark template is easier to read over all but the blues &amp; purples aren't high enough contrast for the background. It’s funny.  I prefer dark mode on everything digital - the laptop, the ipad, the phone, etc., but when it comes to digital note-taking on GoodNotes, I think I prefer the regular white paper with dark ink. I like the dark paper more. The problem is if you send it to someone or when you change to light mode, it doesn’t adapt automatically.",Question
tag classification,"Full diskThe message saying that my disk is full has popped a few times over the last few months, I wonder if I upgraded to an iPad with a larger storage I’d stop having this problem or it’s independent from the iPad storage and has to do with a limit on how many files I can have uploaded to the appPossibly iCloud storage? Just go to the iPad settings app then tap iCloud and it should tell you.

You can also check if it's device storage by going to the settings app then general then storage. Is there a work around for this if I’m not trying to pay for additional iCloud storage? If you don't want to pay you can always just move old content from the iCloud to like a harddrive or USB storage, and delete anything you don't need on there. PDFs can be big but usually it's movies and audio files too. 

But getting iCloud honestly isn't too too bad it's like $1.50 per month (that's either Canadian or Australian dollars) for their cheapest option which I'm using. Just mentioning this as I really did not want to at first as I assumed it would be typical apple overpricing but it's surprisingly affordable.

Also, if you're seeing you've got a lot of space available on your harddrive, I think you just have to play with the iCloud settings to tell it to not automatically upload everything from certain files. I roughly recall doing it before and it not being impossible.",Question
tag classification,"I use the app with Apple Pencil 1st gen and I’m having a problem. While I‘m writing it moves to another part of the paper, like it isn’t rejecting palm. Anyone knows what is the problem and how to solve this?Greetings, \/u/Yash_suraj! Your subsmission from youtu.be has been automatically removed because it violates Rule 3 (must be a news article). **Only news articles may be submitted, YouTube videos do not qualify.** [For more information on Rule 3, click here.](https://www.reddit.com/r/nottheonion/wiki/nto101#wiki_rule_3.3A__must_be_a_news_article.)
 
 For a complete list of domains that are not allowed, [click here](https://www.reddit.com/r/nottheonion/wiki/autoremoval). If you're new to \/r/NotTheOnion, you may want to check out [NTO101: An Introduction to \/r/NotTheOnion](https://www.reddit.com/r/nottheonion/wiki/nto101) for more information on our rules and answers to frequently asked questions.

*I am a bot, and this action was performed automatically. Please [contact the moderators of this subreddit](/message/compose/?to=/r/nottheonion) if you have any questions or concerns.* You seem like a nice person, dude! I’m not defending what Isreal has done or is doing. 

I’m just saying that hamas needs to go",Question
tag classification,"bundle price questions and potential feature?1. if both goodnotes cost 10.99 then i would be paying only 10.99 for the bundle? why is it rated so bad on the app store for the bundle? 
2. What is wrong with it? is it the bundle? of the apps themselves? are the apps different from buying it separately? 
3. Some people say goodnotes 5 was really a down grade compared to goodnotes 4, is it true?
4. I also noticed in some posts here that when buying the bundle it still shows that you have to buy both?
5. will goodnotes add an audio recording option? like record audio while writing?1. No idea why the bundle is rated badly, but the bundle was created so that users of GN4 can upgrade to GN5 for free. You should just get the bundle because it will give you both versions. 

2. I think point 1. answers this too.

3. To me, definitely. I like the new interface and infinite scrolling, but one thing that I can never get over with is that they changed the inking behaviour. I used to love GN4 for their pen alone, even though they were missing some features. They changed the only thing I cared about. GN5 is also a battery hog compared to GN4.

4. Don’t know how this could happen.

5. Don’t know, but I’m sure the devs are aware of the demand for it. I’d honestly just recommend that you go for Notability if you want this feature. Their implementation is flawless.",Question
tag classification,"Will Adonit Jot Pro work for goodnotes 5 on an iPad mini 3?I’m looking into digital note taking and goodnotes looks great, but the problem is I only have an iPad mini 3. Apple Pencil isn’t compatible with it... I’ve looked into Adonit Jot Pro, but I don’t know if it will work. On the website it says it works on “all touchscreen devices” but I don’t know if an iPad mini 3 will be able to distinguish between the stylus and my hand. Help??When you say 

&gt;""... but I don’t know if an iPad mini 3 will be able to distinguish between the stylus and my hand.""

If you're asking about palm rejection within goodnotes, I would bet it won't. Goodnotes supports only Apple Pencil as a stylus. So I believe it is going to treat any other stylus as passive, and probably palm rejection will be subpar or non-existent.",Question
tag classification,"Drag Scrollbar on iPadOS 13In iPadOS 13, Apple made it possible to grab the scrollbar and drag it to scroll through webpages/PDFs/etc faster. However, I cannot seem to drag the scrollbar in GoodNotes. Anyone having success getting this to work? Does GoodNotes use a custom scroll view?works on outline view",Question
tag classification,"Looking for same paper as GoodNotes4This paper style worked perfectly for me in GoodNotes4: https://i.imgur.com/w3wYLB8.png It had 32 lines and the spacing was just right for my eyesight. 

I cannot get this same style in GoodNotes5. The new paper styles are either too wide or too narrow. Or perhaps I'm not selecting the right type? 

Does anyone know how I can get that exact same paper style I have in my link above in GoodNotes5?https://www.dropbox.com/sh/n5yqa0y3aghj6n3/AABut7OvORPYQJ-G1AUovBCXa/3%20-%20GoodNotes%204%20Legacy%20Templates/Papers?dl=0&amp;subfolder_nav_tracking=1 goodnotes manages a dropbox with additional papers and covers that aren’t in the app, including the legacy papers from goodnotes 4which I’ve linked directly to for you! Last year I was able to find a folder from the GoodNotes website that had all(?) of the templates from GoodNotes 4. I’ll have to go look for the link. If/when I find it I’ll post it. I still have GoodNotes4 installed on my iPad. Do you know how I can access the directory?",Question
