prefix,input_text,target_text
tag classification,"Which backup is the best for good notes - Dropbox or google drive ?I’m on iPadOS and I know icloud doesn’t offer backup - except real time syncing. Just wonder what backup is fuss free and reliable.Using Google Drive. Saving in both PDF &amp; Goodnotes format.

It's been working without a problem and if I need to view my notes on Android or Windows it's as easy as opening Drive which is apart of my workflow anyways. [deleted]",Question
tag classification,"How do I put an image on top of an image?I’m usibg Good Notes 5 for bullet journaling (also school) and most of my designs involve layering of ‘stickers’. I mean, it’s doing it but . . . I need the other sticker to be over the other. I can’t find any tutorial on this lol. 

I only installed this app like a few hours ago so I’m still adjusting sjsjsjsj.The sticker pasted first will go to the bottom. So if you want an image to go on top, simply cut it and paste it again. It will then be on top. Ohhh thanks, happy cake dayy! Happy cake day !",Question
tag classification,"Significant Lag on GoodNotesAnybody has significant lag on GoodNotes? I Wrote after 3 months today. There was significant lag. I offloaded &amp; reinstalled the app again. No use. Restarted ipad. Nothing helped. Is there a way to reduce the lag. 

I use ipad pro 10.5

Does it have anything to do with IOS 14?
Any suggestions to improve?

I have iCloud sync on in goodnotes. No backup. So if I uninstall and reinstall the app will the notes in the app restore from iCloud?Same issue here. It started on my ipad, and now it has been giving me trouble on the imac as well. It loads small files no problem (say notes and such), but it's hell with larger files like textbooks. I found exporting the notebook and reimporting it again, after deleting the existing notebook reduce lag. Did the issue start after you updated to ios 14? There was another post here about such a lag on large pdf files after ios 14 update.",Question
tag classification,"Writing to text conversion?Wondering if there is any other method of converting written text to typed text than the copy/paste? That is rather annoying.He’s right though, mando content is a sequel meme. You start with 2 and once you use those two you can only get it back with primary kills, so if you wanna ape someone you need to get a primary kill first Ekchoti yo post ni hernu: https://www.reddit.com/r/technepal/comments/ns59a2/mobile_ra_sim_ma_imei_imsi_ra_iccid_vaneko_k_ho/?utm_medium=android_app&amp;utm_source=share",Question
tag classification,Help it keeps showing this message. I've already updated my app. It won't let me study 😭Need to update to v5.4.31 or so to get rid of that alert. Just delete and re-download if updating on all your devices doesn’t work. I just did that five minutes ago and it’s fixed. I did that thank you!!! It helped lol,Question
tag classification,"Issues printingI’m trying to print my notes on my IPad, and they’re not filling the page. I’ve changed the setting on goodnotes to A4, however it’s still not filling. Can anyone help? Thank you in advance !I usually put what I want to print into a pages or word doc to resize",Question
tag classification,"5.3.3 doesn't workWorks great for me. I use it like 5-6 hours a day. iPad Pro, 12.9 (3rd Gen), iPadOS 13.1.2 Same here, although I use the iPad 9.7 inch (6th generation) I notice this issue sometimes when I select it in the dock. However when I press the app icon on the main list of apps, it works.",Question
tag classification,"I saw a suggestion that someone takes their notes on grid paper, then changes it to blank paper when done. How do you change a paper type after it’s already been written on? I only know how to add more pages, but is it actually possible to change the paper type once it’s been written on?the three dots -&gt; change template 😊 Can you do that for multiple pages at a time, or just one by one? No only once but goodnotes is considering it",Question
tag classification,Can’t preview the cover and page types? Anyone know of any fix? (sorry if it’s been asked before)Gear icon -&gt;Settings-&gt; troubleshooting -&gt; regenerate missing thumbnails thanks! didn’t work for me unfortunately 😔,Question
tag classification,"Are duplicate file names possible?I have notability and it infuriates me that I cannot have two files with the same name even in different classes/subject.

For example, in Goodnotes, is it possible to have multiple folders called ""HW"" for various class folders?yea that’s possible in goodnotes Sold. I'll buy goodnotes.

Notability is nice enough to write in, but holy hell is the file organization a nightmare.

Thanks for replying.",Question
tag classification,"If I posted free digital stickers, would you use them?If so, please comment any requests, and I’ll make it ASAP completely for free :)Yes 🥺
Cute sticky notes with gray or white background Do you want it to be lined, dotted, etc.? Or blank? Blank! If you see on Pinterest just digital sticky notes, like that 🥺
I started making my own but I’ve been a bit busy",Question
tag classification,"Goodnotes on iPhoneDoes anyone take written notes using the iPhone? If so what stylus do you use. I’m a long time lurker, first time poster and I have be some very fond of the app. However, I don’t own an iPad (yet) and don’t want to purchase the app if there are not enough features with the iPhone to justify purchasing it. TIA.[deleted] Thanks If ppl are saying it’s a good strat, they’re being foolish.  But at the same time, they’re still up 2-1 with time to adjust to Vegas’ defense.

They only needed a split in Vegas, I got faith they ain’t rolling over for game 4.",Question
tag classification,"Is this a common bug, or is it Just me?Compare the left to right, The left text is much thinner. The right is pressure sensitive. I have this moment where the pressure sensor works, and GoodNotes works as intended. Most of the time, it feels sluggish and buggy. Is anyone else getting this, and is there a fix? You sure it’s goodnotes and not your iPad maybe? [deleted]",Question
tag classification,"Exporting- PDFs are Blank?I’m trying to export my journals from GoodNotes to a PDF file, but it always ends up with blank pages!

I’ve tried exporting the PDF from GoodNotes as a flattened file or an editable file, and tried opening them in my Google Drive, or using Acrobat, and they are always empty. Just the cover and the pages- but none of the other content! I use GoodNotes for journaling- so it’s just lots of my writing and an image here and there, nothing fancy.

I’d like to have my journals backed up as a PDF (that I can actually read!), so any help would be appreciated. Everything I could find online was not helpful or for GoodNotes 4.

I’m using GoodNotes 5.4.36 on an iPad Pro running iOS 13.6

Thanks!You probably need to enable background in the export settings. All right saving it as an editable file with the annotations and background turned on worked. I thought I tried that combo but obviously not!

Thank you so much! No problem 👍🏻",Question
tag classification,"2020 CalendarThis is my first time making something like this and I thought I would share! Let me know if you guys like it and any tips or recommendations you have for me. I’m thinking of making a planner soon 
[Calendar](https://drive.google.com/file/d/1H-7j8irjBY7a2D9tIcqCQGSJjX3SK6rZ/view?usp=drivesdk)Love it! Love the colorful setup! Thank you for sharing! Nice!!! Love it!",Templates
tag classification,"Opening 2 pages / pdf side by side Is there any way to open 2 pdf files side by side?

Can i also open 2 different pages from the pdf side by side? How should i go about doing it?

Export one of the pages as pdf / image / goodnotes file (open both goodnotes 4 and 5 together)?

Appreciate your kind help, this is really important to me thanks! :)- iOS 13 will bring the ability to open two instances of GoodNotes side by side. Then you can have two PDFs open simultaneously. 

- I'm not aware of being able to have two pages open within the same PDF within the same app instance. Are you trying to have a 2 page view like on Word, or do you want two pages that are not adjacent to each other? Yes that's right, being able to view 2 pages in the same pdf which are not adjacent to each other. 

I'm curious about iOS 13 opening up 2 instances of good notes side by side. If both instances i open the same file and i make changes on one, will it update in real time? You'd have to confirm with someone on the beta but I doubt it. You'd probably have to wait for them to sync.",Question
tag classification,"How do I move or remove an element?I've used some of the stickers available with the new elements feature, but I can't seem to be able to move it or remove it after they've been placed.Lasso or image tool should fix the problem. Oh thanks it's the image tool!

I tried the lasso before but it didn't work. Didn't think to try the image tool.",Question
tag classification,"Resizing image/stickers to specific dimensionI just made the jump into digital planning with Goodnotes. When you insert stickers, it's never the perfect size for your boxes/grid/however your planner page is structured. 

Manually manipulating the blue dot to fit it to the grid is imprecise and there's always overlap no matter how I try (also the apple way of resizing which moves both sides rather than just one makes it hard to line it up how I want).

Is there a more precise way to resize these images to the box dimension? Maybe a way to specify a 1:1 or 1:2 ratio?omfg in searching google for an answer to this. i wish there way some way to type in specific dimensions so i can make all my stickers the same size in my sticker book. yes, OCD much. if i find an answer/way, i’ll let you know. I wish this was already possible. Here I am looking all over the net for answers... I saw this 2017 post about image resizing so I don't think it's been addressed till now. :((",Question
tag classification,"Artists’ support, I created an art journal on GoodNotes 5! Subscribe if you like it!Dont worry sir im ready for use. Dm me master Aggressively average If I described it out of context it'd probably sound like a goofy Mr. Bungle type joint but, no, its unorthodox parts come together to make a totally coherent and masterful symphonic black metal release. RIP Baron Blood.",Review
tag classification,Smaller box sizes graph paper? Or just recommendations for paper size/color/type and pen size etc/color?Does anyone know if there’s a smaller sized graph paper set? Or does anyone have any paper types they’d recommend?https://www.dropbox.com/s/x3oeoohy9zk8hzb/A4%204mm%20White%20Cornell.pdf?dl=0 I really like this one!,Templates
tag classification,"Legal TemplateSo i see that goodnotes has the “legal” paper template in yellow only, does anyone know where i can find the same template in a4 but in white or dark grey?It’s just a pdf. Make your own. if i knew how to make my own dont you think i would? Thanks for the unhelpful response though 1. Open MS Word or any word process or powerpoint/keynote

2. Make a template

3. Save as PDF

4. Import into Goodnotes.",Question
tag classification,"Why isn’t GoodNotes indexing anything on this file? The ‘text’ isn’t selectable, but GN used to be able to index these as long as they were clear enough (which it is, even clearer than the files it used to work on). It’s very important to me that it works, so please any help? Why isn’t it working?How did you import this?  If it is a PDF - then it should work.  If it is an image then I don't think it will work.  I searched for idsel which is in an image and a PDF in my notes.  It found the PDF word but not the image word. It was a pdf, that’s why I’m confused :( thanks for looking btw. Could there be any other problem? Maybe the creator of the pdf didn’t type the info on the pdf but rather he imported a photo and made it a pdf",Question
tag classification,"Does this happen in Goodnotes? I want to use an image in the background but without this layer overlapping other things if I miss click itBTW the text layer was the new one. So yeah I use the copy/paste trick but in notab\* if you missclick the background layer it overlaps everything.

I just want to know because this is the only thing that I need and I already watched like 203498324 video reviews about goodnotes and no one says anything about layers... No layering, everything just gets placed on top as it’s created or altered, at least to my knowledge Best workaround for this I've found is if you created the graph or whatever you want to be stuck in place first, export the page as a PDF, then import that PDF back into your good notes notebook and continue. That way the graph etc will be part of the document. Idk if this helps but that's all I got!",Question
tag classification,"GoodNotes 5 CrashingMy GoodNotes app keeps crashing whenever I try to open a new textbook file on the app. Anyone else experiencing this? It’s super frustrating.Thank you! I’m not tryna defend nm or anything I’m just hoping they do go forward and improve how we want them too but.

They literally are addressing the issue with content by adding content that they just showed off lol



Also i don’t understand the netmarble and Diane points can you elaborate more on those?

Also people can be hype for something we don’t have to always be angry at everything we can be hype and excited for the great things they do but still hold them accountable for the bad and hope they fix them no sense going through this game and it’s changes with a pissed off attitude He's just on loan from Darvish",Review
tag classification,"QuestionHello!, I imported a book (PDF) to good notes, the document is in portrait, I would like to change the orientation to landscape. but the app replaces the original page with a blank page. any chance to do this but conserving the original page so I can have extra space for notes?What about importing as an image? Can you edit the pdf file before importing it? Would the file lose the text recognition?",Templates
tag classification,"Differences Goodnotes vs NotabilityHey, everyone! Nice to meet you!
First of all, I don’t want to rivalize these two apps, i just really want to know the main differences of each app since I don’t have an iPad right now and was wondering which app to buy when I get a new iPad next Black Friday.
Thank you for your time![removed] Best just go to youtube there are tons of in-dept comparison videos. Personally, i like GoodNotes much better, more convenient. Although Notability has the recording tool which you can use to trace back the voice when the word was written important Notability exclusive: audio recording

important Goodnotes exclusives: outline, tab",Question
tag classification,"I made some composition-style notebook covers and I wanted to share them with you all. Every cover has two styles. One with a semi-opaque text box and one without.They look cool! Thanks for uploading these. 👍🏻 Thank you! They’re so nice :) Sweet, thanks!",Templates
tag classification,"Possible to create a table?Is there a way to insert a table? Versus the shape draw tool is there a table tool somewhere I am missing on Goodnotes 5?

&amp;#x200B;

Thanks!not that i’m aware of Unfortunately not, one of the features I would really like them to add, that and dashed/dotted line option with the shapes tool.",Question
tag classification,"I made some grid based templatesYou can find them here https://www.dropbox.com/sh/7z2lw1ylbw24uwk/AAA7y_iFtINOZUqfEyKgzWR_a?dl=0

I’m still not entirely sure what the ideal grid size and type is for me so I’m still adjusting as I go.Thanks! Thank you so much sir💪💪 Thank you so much!",Templates
tag classification,"Notebook CoversYou right now and you have my full attention 🥵😈 ###SexSells Stats for /u/AngelKittenPie
* Verification: **Trusted Seller** [learn more](https://www.reddit.com/r/Sexsells/wiki/verification)
* Account Age: **525** Days | Karma: **16792**
* No. of Listings: **100+** [view](https://www.reddit.com/r/Sexsells/search?q=author%3A%22AngelKittenPie%22&amp;sort=new&amp;restrict_sr=on&amp;feature=legacy_search) | No. of Reviews: **94** [view](https://www.reddit.com/r/Sexsells/search?q=flair%3Areview%20%28title%3A%22AngelKittenPie%22%20OR%20title%3A%22angelkittenpie%22%29&amp;sort=new&amp;restrict_sr=on)

---

[Wiki](https://www.reddit.com/r/Sexsells/wiki/index) | [FAQ](https://www.reddit.com/r/Sexsells/wiki/faq) | [Bot Info](https://www.reddit.com/r/Sexsells/wiki/bot) | [Report a Bug](/message/compose/?to=irrational_function&amp;subject=SexStatsBot%20Bug&amp;message=The%20post%20with%20a%20bug%20is%3A%20https%3A//redd.it/nsoc0f) | [Modmail](/message/compose/?to=/r/Sexsells)

---
^(Version 0.7.7. Generated at: 05:15:10 UTC 2021-06-05) Knight the fuck up ⚔️⚔️⚔️⚔️⚔️⚔️",Templates
tag classification,"Do you like a scan in GoodNotes?Clearly, you've never had a lover from the Mediterranean. Done, please upvote my Pinned Post! Oh please! join r/banglaAudiobook Just watched that episode tonight. Still at awe of how he keeps a straight face saying PIMPS.",Question
tag classification,"Ok, I revised the spread and lowered the price. Please, go check it out and support if you’re feeling supportive lol. Would love any constructive feedback😊. https://www.etsy.com/shop/pleaseremindmemake it not ugly Dang! 😂😂 what’s ugg about it so I can take notes from a planner master like yourself? I’d add a white and black background option. The blue makes it hard on the eyes",Templates
tag classification,"Geometric CoversI like super different covers for my millions of notebooks -- here are three I made! Hope you like it! &lt;3 

Links are:

[https://storage.googleapis.com/file-in.appspot.com/files/8m\_w-4iuQF.goodnotes](https://storage.googleapis.com/file-in.appspot.com/files/8m_w-4iuQF.goodnotes)

[https://storage.googleapis.com/file-in.appspot.com/files/0NA2SWHxIm.goodnotes](https://storage.googleapis.com/file-in.appspot.com/files/0NA2SWHxIm.goodnotes)

[https://storage.googleapis.com/file-in.appspot.com/files/OjjIzF7OZB.goodnotes](https://storage.googleapis.com/file-in.appspot.com/files/OjjIzF7OZB.goodnotes) (the one shown)

https://preview.redd.it/gtz64q8lbue51.jpg?width=2244&amp;format=pjpg&amp;auto=webp&amp;s=034da52fd8d8a5699c6627139c65d6c510b49c85I've always wondered but never asked, guess this is a good time... Is it just me or does terry slur his words in interviews and always sound like he's half in the bag? I literally have no words ###[View link](https://redditsave.com/info?url=/r/fatyoshi48/comments/nsnbn1/family_guy_funny_moments_epic_sex_edition_try_not/)


 --- 
 [**Info**](https://np.reddit.com/user/SaveVideo/comments/jv323v/info/)&amp;#32;|&amp;#32; [**Feedback**](https://np.reddit.com/message/compose/?to=Kryptonh&amp;subject=Feedback for savevideo)&amp;#32;|&amp;#32;[**Donate**](https://ko-fi.com/getvideo) &amp;#32;|&amp;#32; [**DMCA**](https://np.reddit.com/message/compose/?to=Kryptonh&amp;subject=Content removal request for savevideo&amp;message=https://np.reddit.com//r/fatyoshi48/comments/nsnbn1/family_guy_funny_moments_epic_sex_edition_try_not/)",Templates
tag classification,"Digital NotebookTrying to make a good digital notebook that I can access on my iPhone and iPad. I can't seem to get the text typing to work like I think it should. 

Is there no way to make bulleted lists? Or Checklists? 

Goodnotes doesn't seem to be great if you don't want to use a Stylus of some sort. Am I correct in this assumption?I think you are correct. It works wonderfully if you use a stylus for handwritten notes primarily. 

I’ve found OneNote to be a better option for mixing handwriting and type and it’s accessible on any platform. Notability is better if you want to type a lot. It has better formatting for text, including bulleted lists and checklists.",Question
tag classification,"Is it possible to insert blank pages OF THE SAME WIDTH as the existing pages in the file?I recently tried Notability for a short while and this feature amazed me. 

I use my lecture slides provided by profs, and insert blank pages for my notes in them. In Notability, the newly inserted pages automatically have the same width as the lecture notes. 

Is this somehow possible in GoodNotes? Because overall I do prefer GoodNotes.Something I also wish to know. I usually put a huge white sticker to hide the content and write on it but it gets messy when using the select tool :/ Not as far as I know. However I've encountered this problem as well and realized for the lecture slides my professors provide the landscape ""square paper"" that GoodNotes shows when pressing the plus page button (not pull to add a page !) seems to be the exact same size as my slides. 

If that's not the case, you could import a blank slide as a template but that's certainly more tedious and not so convenient I would also like to know",Question
tag classification,"Apparently this feature of points on shapes came out in Sept 2020 but I only just noticed it and now can’t live without it! Always late to the party...How did you get the points to show up? Lol I feel like that’s what I’ve been missing. Once you’ve turned it into a shape (by holding down pencil) you tap on it with your finger and the points come up :) Perfect, thank you!",Review
tag classification,"App laggy due to photos   Recently I’ve began to explore using goodnotes to journal. However, one thing I noticed is that adding photos to a page makes it insanely laggy—it’ll take up to 2 minutes to load that one page, and even after it’s loaded I can’t move stuff around too much or the page will go blank again. 

   Had anyone else faced this problem, and how did you get around it?What specs is your iPad? I'm curious about this because I'm beginning to suspect the lagging issues may be due to the fact that the iPad models currently out there don't have enough internal memory to handle heavy loads. If that same document you have could be put on a theoretical Windows machine with plenty of memory this lagging issue would disappear. Or even an iMac Pro. If the iMac Pro ever goes touch enabled like the iPad...you could say goodbye to the iPad. So I double Apple will do this as it appears they're trying to replace the iMac Pro with the iPad Pro with the introduction of the new keypad. Mine’s the 2016 iPad pro, 2GB ram. mine does this too, does anyone know how to fix it :(",Question
tag classification,"iPad stylus rubber tipDo you know a good rubber tip for the ipad pencil that won't break after 2 days of usage?

I bought a moderately priced pack, but they seem to break after 3-4 pages, and they are a bit softer than I thought, therefore I suspect that there are harder ones that are more tough.

Do you have any advice?From the pack I bought, one tip has lasted a couple weeks of daily lecture notes and hw.

IDK if mine will will work as well for you, but here's the link.

https://www.amazon.com/gp/product/B082L23PKG/ref=ppx\_yo\_dt\_b\_search\_asin\_title?ie=UTF8&amp;psc=1",Question
tag classification,"Finally... GoodNotes 5! Did I miss anything in this video? Tried to point out all the ""new"" features.Man i imagined you would be a lot more popular in this sub. Love your channel :)  Thank you :)",Review
tag classification,"Cornell templateDoes anyone know if there’s a Cornell template but with the Dotted paper as well as jet black? 
Ive been googling and searching and haven’t been able to find any that’s dottedYes, some girl on youtube has some. I cannot remember what her name was though. Sorry! u/janicestudies ! I don't have the link to her google drive anymore but if you look through her Reddit or search for her on YouTube you should find them. I love using her templates Yes! Thats the one! Thanks!",Templates
tag classification,"We will never have recording feature because Notability has patented that?I used GoodNotes for a long time and i always hope GoodNotes will have recording feature like Notability one day.  
But there are so many years and the recording feature is still not in test version. I'm just curious if it's just a technical problem or even a legal problem and GoodNotes developers do not tell us to keep our hopes up.  
So i did a little research and found this patent of Microsoft:  
[https://patentimages.storage.googleapis.com/d1/9d/f1/b4b985fda39a1f/US9910840.pdf](https://patentimages.storage.googleapis.com/d1/9d/f1/b4b985fda39a1f/US9910840.pdf)  
As you see, Notability is an ""other publication"" and GoodNotes aren't.  


I don't know much about patents and does it mean that GoodNotes can't have recording feature because it doesn't have this patent?

If it's true, it gonna be a big disappointment for us because it's the most wanted feature in GoodNotes :(Dont think so. The app Noted. has a similar recording feature, so don’t think that’s what is holding them back They can create their own audio recording in the Nord taking app but they might have some troubles on how the actual thing is going to work. I don’t think they are going to stop working or considering it. The patent mentioned is completely different than what notability does. I’ve used notability for years, but switched recently. I do miss recordability, but it seems that goodnotes has increased quality with notetaking and more options compared to notability. I like most users, use both apps, especially if there is a certain need.",Question
tag classification,"My simple pen color collection (HEX in comments)From yellow down to green— 
EEDFA6
EBB494
E8A7A4
E6A7C4
B79BC5
999EC9
95C1E1
99CDCC
9DCAAA
CEDFAB They seem awesome! Thank you these are beautiful, thank you!",Templates
